{
  "$schema": "https://json-schema.org/draft/2020-12/schema",
  "$id": "https://blitzy.io/acceleration-report/schemas/releases.schema.json",
  "title": "Release Inventory",
  "description": "Output of 04_extract_releases.py. Records the production release inventory with prereleases segregated per AAP \u00a70.5.3.10. Source precedence: GitHub Releases API -> annotated git tags matching semver -> CI deploy events. The chosen tier is recorded so the report's Methodology section can explain how the count was derived. The schema enumerates every root-level field used by both (a) the hand-authored seed (network unavailable; chosen_tier 'none' -> Metric 9 'insufficient_signal') and (b) the live extraction output. This satisfies AAP \u00a70.9.2 (Schema-Driven Validation) for the seed-document contract.",
  "type": "object",
  "additionalProperties": false,
  "required": ["_metadata", "releases", "prereleases", "chosen_tier"],
  "properties": {
    "_metadata": {"$ref": "#/$defs/metadata"},
    "tier_availability": {
      "type": "object",
      "description": "Per-tier availability snapshot to explain the chosen_tier in the decision log. Open shape: the live extractor and the hand-authored seed both use this block, but the seed nests per-tier details under tier_1_github_releases_api / tier_2_annotated_tags / tier_3_ci_deploy_events keys while the live extractor may use flat boolean fields. additionalProperties is true to accommodate both layouts.",
      "additionalProperties": true,
      "properties": {
        "github_releases_api": {"type": "boolean"},
        "git_tag_scan": {"type": "boolean"},
        "ci_deploy_event": {"type": "boolean"},
        "tier_1_github_releases_api": {"type": "object"},
        "tier_2_annotated_tags": {"type": "object"},
        "tier_3_ci_deploy_events": {"type": "object"}
      }
    },
    "chosen_tier": {
      "type": "string",
      "enum": ["github_releases_api", "git_tag_scan", "ci_deploy_event", "none"],
      "description": "Which source-precedence tier yielded the release inventory. 'none' indicates no tier produced data and Metric 9 will report Insufficient signal."
    },
    "chosen_tier_rationale": {
      "type": "string",
      "minLength": 1,
      "description": "Free-text justification for the chosen_tier value, surfaced in the report's Risk Assessment section when chosen_tier is 'none' or non-primary."
    },
    "releases": {
      "type": "array",
      "description": "Primary release inventory (non-prerelease entries). May be empty if no releases exist by any tier.",
      "items": {"$ref": "#/$defs/releaseEntry"}
    },
    "prereleases": {
      "type": "array",
      "description": "Prerelease entries (tags matching -alpha, -beta, -rc, -dev suffixes), kept separate from the primary count.",
      "items": {"$ref": "#/$defs/releaseEntry"}
    },
    "summary": {
      "type": "object",
      "additionalProperties": true,
      "required": ["total_releases", "total_prereleases"],
      "description": "Roll-up counts derived from releases[] and prereleases[]. All zeros are valid when chosen_tier is 'none'.",
      "properties": {
        "total_releases": {"type": "integer", "minimum": 0},
        "total_prereleases": {"type": "integer", "minimum": 0},
        "releases_per_2week_window": {"type": "array"},
        "earliest_release_iso": {"type": ["string", "null"], "pattern": "^\\d{4}-\\d{2}-\\d{2}T\\d{2}:\\d{2}:\\d{2}Z$"},
        "latest_release_iso": {"type": ["string", "null"], "pattern": "^\\d{4}-\\d{2}-\\d{2}T\\d{2}:\\d{2}:\\d{2}Z$"},
        "release_frequency_mean_per_window": {"type": ["number", "null"], "minimum": 0},
        "release_frequency_mean_per_window_reason": {"type": ["string", "null"]}
      }
    },
    "upstream_changelog_reference": {
      "type": "object",
      "additionalProperties": true,
      "required": ["file", "note"],
      "description": "Cross-reference to the upstream-inherited CHANGELOG.md. The note field MUST document that entries pre-date this fork's lifespan and MUST NOT be used as the release inventory (per AAP \u00a70.2.1.1 and \u00a70.2.3).",
      "properties": {
        "file": {"type": "string", "minLength": 1},
        "size_bytes": {"type": "integer", "minimum": 0},
        "line_count": {"type": "integer", "minimum": 0},
        "approximate_entry_count": {"type": "integer", "minimum": 0},
        "verification_commands": {
          "type": "object",
          "additionalProperties": {"type": "string"}
        },
        "first_entry_excerpt": {"type": "string"},
        "last_entry_link_pattern": {"type": "string"},
        "note": {"type": "string", "minLength": 1}
      }
    },
    "prerelease_suffix_pattern": {
      "type": "string",
      "minLength": 1,
      "description": "Regex pattern (as a string) used to identify prerelease tags. Default: '-(alpha|beta|rc|dev)(\\.|$)'."
    },
    "prerelease_suffix_pattern_source": {
      "type": "string",
      "minLength": 1,
      "description": "Citation of the source for prerelease_suffix_pattern (e.g., 'AAP \u00a70.5.3.10')."
    },
    "provenance": {
      "type": "object",
      "additionalProperties": true,
      "required": ["spec_section", "source_precedence", "downstream_consumer", "producing_script"],
      "description": "Per AAP \u00a70.5.6 Provenance Trail discipline: link this artifact to its specification section, source precedence, downstream consumer, and producing script. Satisfies Rule 1 (Data Provenance) at the artifact level.",
      "properties": {
        "spec_section": {"type": "string", "minLength": 1},
        "source_precedence": {
          "type": "array",
          "items": {"type": "string", "minLength": 1}
        },
        "downstream_consumer": {"type": "string", "minLength": 1},
        "downstream_consumer_field": {"type": "string"},
        "downstream_consumer_expected_when_chosen_tier_is_none": {"type": "string"},
        "producing_script": {"type": "string", "minLength": 1}
      }
    }
  },
  "$defs": {
    "metadata": {
      "type": "object",
      "additionalProperties": false,
      "description": "Standard _metadata envelope shared by hand-authored seed artifacts. The inflection_date_utc field is the canonical phase-partition key referenced in every downstream metric per AAP \u00a70.5.6 and is required so the Rule-4 Internal Consistency contract is mechanically satisfied.",
      "required": [
        "extraction_timestamp",
        "run_id",
        "repository_slug",
        "default_branch",
        "analysis_period_start",
        "analysis_period_end",
        "inflection_date_utc"
      ],
      "properties": {
        "extraction_timestamp": {
          "type": "string",
          "format": "date-time",
          "pattern": "^\\d{4}-\\d{2}-\\d{2}T\\d{2}:\\d{2}:\\d{2}Z$",
          "description": "Wall-clock UTC timestamp at which the release inventory was captured. Equivalent to the schema's pre-fix root-level `fetched_at` field; relocated under `_metadata` for consistency."
        },
        "run_id": {
          "type": "string",
          "pattern": "^[0-9a-fA-F]{8}-[0-9a-fA-F]{4}-4[0-9a-fA-F]{3}-[89abAB][0-9a-fA-F]{3}-[0-9a-fA-F]{12}$",
          "description": "Per-run correlation ID (UUID4) generated by 00_environment.sh and propagated via BLITZY_RUN_ID."
        },
        "repository_slug": {
          "type": "string",
          "pattern": "^[^/\\s]+/[^/\\s]+$",
          "description": "GitHub repository slug in 'owner/name' form."
        },
        "default_branch": {"type": "string", "minLength": 1},
        "analysis_period_start": {
          "type": "string",
          "format": "date-time",
          "pattern": "^\\d{4}-\\d{2}-\\d{2}T\\d{2}:\\d{2}:\\d{2}Z$"
        },
        "analysis_period_end": {
          "type": "string",
          "format": "date-time",
          "pattern": "^\\d{4}-\\d{2}-\\d{2}T\\d{2}:\\d{2}:\\d{2}Z$"
        },
        "inflection_date_utc": {
          "type": "string",
          "format": "date-time",
          "pattern": "^\\d{4}-\\d{2}-\\d{2}T\\d{2}:\\d{2}:\\d{2}Z$",
          "description": "Canonical AI-introduction inflection point. Module-scope constant per AAP \u00a70.5.6: identical across inflection.json#date_utc, metrics.json#_metadata.inflection_date_utc, per_engineer.json#_metadata.inflection_date_utc, and pulls.json#_metadata.inflection_date_utc."
        },
        "seed_note": {
          "type": "string",
          "description": "Optional free-text note documenting that this artifact is the hand-authored seed (will be overwritten by the live extractor)."
        },
        "seed_created_at": {
          "type": "string",
          "format": "date-time",
          "pattern": "^\\d{4}-\\d{2}-\\d{2}T\\d{2}:\\d{2}:\\d{2}Z$",
          "description": "Wall-clock UTC timestamp at which the hand-authored seed was originally drafted. Distinct from `extraction_timestamp`, which is the canonical per-run correlation timestamp. The renderer ignores this field and uses `extraction_timestamp` for run correlation; this field is archival only."
        },
        "seed_created_at_note": {
          "type": "string",
          "description": "Optional free-text justification for keeping `seed_created_at` separate from `extraction_timestamp`. Documents why the original seed creation moment is preserved alongside the run-correlation timestamp."
        },
        "extraction_timestamp_alignment_note": {
          "type": "string",
          "description": "Optional free-text note recording that the artifact's `extraction_timestamp` was deliberately aligned to the canonical per-run timestamp captured in `data/environment.json#extraction_timestamp`. Honors Rule 4 (Internal Consistency) by making the alignment visible in the artifact rather than implicit."
        },
        "artifact_kind": {"type": "string", "minLength": 1},
        "schema_version": {"type": "string", "pattern": "^\\d+\\.\\d+\\.\\d+$"},
        "schema_version_change_note": {
          "type": "string",
          "minLength": 1,
          "description": "Free-text justification for the latest schema_version bump. Lets a reviewer scan recent CP-remediation changes without diffing the schema file. Required only when schema_version differs from the prior release; permitted but unused otherwise."
        }
      }
    },
    "releaseEntry": {
      "type": "object",
      "additionalProperties": true,
      "required": ["tag_name", "published_at", "prerelease", "source_tier"],
      "properties": {
        "tag_name": {"type": "string", "minLength": 1},
        "published_at": {"type": "string", "format": "date-time", "pattern": "^\\d{4}-\\d{2}-\\d{2}T\\d{2}:\\d{2}:\\d{2}Z$"},
        "prerelease": {"type": "boolean"},
        "source_tier": {
          "type": "string",
          "enum": ["github_releases_api", "git_tag_scan", "ci_deploy_event"]
        },
        "name": {"type": ["string", "null"]},
        "body": {"type": ["string", "null"]},
        "html_url": {"type": ["string", "null"]},
        "target_commitish": {"type": ["string", "null"]},
        "draft": {"type": ["boolean", "null"]},
        "created_at": {"type": ["string", "null"], "pattern": "^\\d{4}-\\d{2}-\\d{2}T\\d{2}:\\d{2}:\\d{2}Z$"}
      }
    }
  }
}
